{
  "all_candidates_accounted": true,
  "analysis_grid_sha256": "016db3603b170c180e5a8f28cfcfccaa3dbf60864cffaca0bba4dcaaa5f09f3e",
  "byte_cap_satisfied_candidates": 32,
  "candidate_count": 32,
  "cells": [
    {
      "artifact_sha256": "3e8afaae47e8ade9a40e3390c49fc1c4b1c4d257db1cc83f7fcfddbe4dac277b",
      "byte_cap_satisfied": true,
      "compression_level": 1,
      "container_bytes": 4038,
      "container_header_bytes": 80,
      "dataset": "297b7688a045c583",
      "elapsed_seconds": 0.0005508728791028261,
      "encoding_replay_exact": true,
      "exact_original_bytes_recovered": true,
      "generator_admissible": false,
      "mfs_v2": null,
      "original_charged_bytes": 10787,
      "parent_job_sha256": "f017a37c060938290f8823a56bc173635144c8682f25f0290434d1f5817b9dc6",
      "profile": "features24_steps2048",
      "ptf_v1": null,
      "raw_model_bytes": 3719,
      "raw_projection_bytes": 7068,
      "receipt": {
        "path": "/mnt/fast-scratch/dope-benchmark/dope-s3-artifact-compression-probe-v1/f017a37c060938290f8823a56bc173635144c8682f25f0290434d1f5817b9dc6.level1.receipt.json",
        "sha256": "181c55c39645732092ca279dde8b8a5081ecf6958a7d4212f383eb503ba9efcd"
      },
      "release_safe_l3": null
    },
    {
      "artifact_sha256": "aaa76e9c9b22552726815a466b15861832e3afd0158ee54094f251d9fd1c87d3",
      "byte_cap_satisfied": true,
      "compression_level": 9,
      "container_bytes": 3869,
      "container_header_bytes": 80,
      "dataset": "297b7688a045c583",
      "elapsed_seconds": 0.0007125390693545341,
      "encoding_replay_exact": true,
      "exact_original_bytes_recovered": true,
      "generator_admissible": false,
      "mfs_v2": null,
      "original_charged_bytes": 10787,
      "parent_job_sha256": "f017a37c060938290f8823a56bc173635144c8682f25f0290434d1f5817b9dc6",
      "profile": "features24_steps2048",
      "ptf_v1": null,
      "raw_model_bytes": 3719,
      "raw_projection_bytes": 7068,
      "receipt": {
        "path": "/mnt/fast-scratch/dope-benchmark/dope-s3-artifact-compression-probe-v1/f017a37c060938290f8823a56bc173635144c8682f25f0290434d1f5817b9dc6.level9.receipt.json",
        "sha256": "0426ad08d17fc6ad44da40b328c3bfd3adf325b499208435e2395138a6aa9733"
      },
      "release_safe_l3": null
    },
    {
      "artifact_sha256": "a46d5b83992b48024fab212ff4c7b3e47e9efc32f94f362af8f50e6f0a00d065",
      "byte_cap_satisfied": true,
      "compression_level": 1,
      "container_bytes": 4006,
      "container_header_bytes": 80,
      "dataset": "297b7688a045c583",
      "elapsed_seconds": 0.0006415450479835272,
      "encoding_replay_exact": true,
      "exact_original_bytes_recovered": true,
      "generator_admissible": false,
      "mfs_v2": null,
      "original_charged_bytes": 10781,
      "parent_job_sha256": "aa7619e51f647bce4c17a31c50c33d4486429a1d0abb18a7015881580b64a9b9",
      "profile": "features24_steps512",
      "ptf_v1": null,
      "raw_model_bytes": 3713,
      "raw_projection_bytes": 7068,
      "receipt": {
        "path": "/mnt/fast-scratch/dope-benchmark/dope-s3-artifact-compression-probe-v1/aa7619e51f647bce4c17a31c50c33d4486429a1d0abb18a7015881580b64a9b9.level1.receipt.json",
        "sha256": "e866aafff5e0af6b3fcfdba32f08030bcab47d4e2bae2c3fbfbb7e0a80b66b2f"
      },
      "release_safe_l3": null
    },
    {
      "artifact_sha256": "e0ca4ece780111ea070a007b6681f72e5e32a442b08b4d8b981ca15ecd550b34",
      "byte_cap_satisfied": true,
      "compression_level": 9,
      "container_bytes": 3836,
      "container_header_bytes": 80,
      "dataset": "297b7688a045c583",
      "elapsed_seconds": 0.0007115581538528204,
      "encoding_replay_exact": true,
      "exact_original_bytes_recovered": true,
      "generator_admissible": false,
      "mfs_v2": null,
      "original_charged_bytes": 10781,
      "parent_job_sha256": "aa7619e51f647bce4c17a31c50c33d4486429a1d0abb18a7015881580b64a9b9",
      "profile": "features24_steps512",
      "ptf_v1": null,
      "raw_model_bytes": 3713,
      "raw_projection_bytes": 7068,
      "receipt": {
        "path": "/mnt/fast-scratch/dope-benchmark/dope-s3-artifact-compression-probe-v1/aa7619e51f647bce4c17a31c50c33d4486429a1d0abb18a7015881580b64a9b9.level9.receipt.json",
        "sha256": "d0ef7cfa2b8264f33ce75b26cf9599b97a2a80cc5d97ad2166e116b5e7cf7050"
      },
      "release_safe_l3": null
    },
    {
      "artifact_sha256": "64f8919bfa72a46552b8b65c9a9c56eed2de584a54fa09cc079a4f8e48dee0b4",
      "byte_cap_satisfied": true,
      "compression_level": 1,
      "container_bytes": 7952,
      "container_header_bytes": 80,
      "dataset": "654566a1f91408aa",
      "elapsed_seconds": 0.0007337189745157957,
      "encoding_replay_exact": true,
      "exact_original_bytes_recovered": true,
      "generator_admissible": false,
      "mfs_v2": null,
      "original_charged_bytes": 22233,
      "parent_job_sha256": "00d2332eff942ed7974edabb1b1217be7eca93f688737f5066c33b041019a7c6",
      "profile": "features12_steps2048",
      "ptf_v1": null,
      "raw_model_bytes": 6256,
      "raw_projection_bytes": 15977,
      "receipt": {
        "path": "/mnt/fast-scratch/dope-benchmark/dope-s3-artifact-compression-probe-v1/00d2332eff942ed7974edabb1b1217be7eca93f688737f5066c33b041019a7c6.level1.receipt.json",
        "sha256": "756b1c935a29e239f72addc8eb93f13a59b6236795cf8f6e04bdc395e238534a"
      },
      "release_safe_l3": null
    },
    {
      "artifact_sha256": "7806cf2dffbe59a785808a0c75a58746dcc9e1f0a6bab8e646de11ca74946088",
      "byte_cap_satisfied": true,
      "compression_level": 9,
      "container_bytes": 7644,
      "container_header_bytes": 80,
      "dataset": "654566a1f91408aa",
      "elapsed_seconds": 0.0012291970197111368,
      "encoding_replay_exact": true,
      "exact_original_bytes_recovered": true,
      "generator_admissible": false,
      "mfs_v2": null,
      "original_charged_bytes": 22233,
      "parent_job_sha256": "00d2332eff942ed7974edabb1b1217be7eca93f688737f5066c33b041019a7c6",
      "profile": "features12_steps2048",
      "ptf_v1": null,
      "raw_model_bytes": 6256,
      "raw_projection_bytes": 15977,
      "receipt": {
        "path": "/mnt/fast-scratch/dope-benchmark/dope-s3-artifact-compression-probe-v1/00d2332eff942ed7974edabb1b1217be7eca93f688737f5066c33b041019a7c6.level9.receipt.json",
        "sha256": "f475d1e68fc54e8c2047ec8fa94cd952e9455620df1a2dbbebda21d258f0bc19"
      },
      "release_safe_l3": null
    },
    {
      "artifact_sha256": "ee5e61c5906c75488d86bc6623b0d795688e8359a2c7bfab0d378830c90dcfec",
      "byte_cap_satisfied": true,
      "compression_level": 1,
      "container_bytes": 7925,
      "container_header_bytes": 80,
      "dataset": "654566a1f91408aa",
      "elapsed_seconds": 0.0007459418848156929,
      "encoding_replay_exact": true,
      "exact_original_bytes_recovered": true,
      "generator_admissible": false,
      "mfs_v2": null,
      "original_charged_bytes": 22228,
      "parent_job_sha256": "754928ef6b55be02b5b7750f880339e5e6f358a1a59820b13042bb46eef47704",
      "profile": "features12_steps512",
      "ptf_v1": null,
      "raw_model_bytes": 6251,
      "raw_projection_bytes": 15977,
      "receipt": {
        "path": "/mnt/fast-scratch/dope-benchmark/dope-s3-artifact-compression-probe-v1/754928ef6b55be02b5b7750f880339e5e6f358a1a59820b13042bb46eef47704.level1.receipt.json",
        "sha256": "86b5f0290c4e91aed2619c52e08fe6e08314605ef6dde023ddd7ffdc81cd7d09"
      },
      "release_safe_l3": null
    },
    {
      "artifact_sha256": "1a284952b0a6d858a3f461a26299cdefed4612657d389e7566a94c81eb48720b",
      "byte_cap_satisfied": true,
      "compression_level": 9,
      "container_bytes": 7618,
      "container_header_bytes": 80,
      "dataset": "654566a1f91408aa",
      "elapsed_seconds": 0.001253203023225069,
      "encoding_replay_exact": true,
      "exact_original_bytes_recovered": true,
      "generator_admissible": false,
      "mfs_v2": null,
      "original_charged_bytes": 22228,
      "parent_job_sha256": "754928ef6b55be02b5b7750f880339e5e6f358a1a59820b13042bb46eef47704",
      "profile": "features12_steps512",
      "ptf_v1": null,
      "raw_model_bytes": 6251,
      "raw_projection_bytes": 15977,
      "receipt": {
        "path": "/mnt/fast-scratch/dope-benchmark/dope-s3-artifact-compression-probe-v1/754928ef6b55be02b5b7750f880339e5e6f358a1a59820b13042bb46eef47704.level9.receipt.json",
        "sha256": "8fdc4a866903b6c2f37bc717f7b56a7ec4e613d08342f9e022d3bdf5a5d3e10b"
      },
      "release_safe_l3": null
    },
    {
      "artifact_sha256": "038dd34581a566afc79e6eb3ba7a608fec3b89f0eaac6a3d5840913692f17f89",
      "byte_cap_satisfied": true,
      "compression_level": 1,
      "container_bytes": 8280,
      "container_header_bytes": 80,
      "dataset": "654566a1f91408aa",
      "elapsed_seconds": 0.0007639657706022263,
      "encoding_replay_exact": true,
      "exact_original_bytes_recovered": true,
      "generator_admissible": false,
      "mfs_v2": null,
      "original_charged_bytes": 22853,
      "parent_job_sha256": "59ab5319e1b9031be213e87b92180bfcde08bf410648543464338f59fcae3f0e",
      "profile": "features24_steps2048",
      "ptf_v1": null,
      "raw_model_bytes": 6876,
      "raw_projection_bytes": 15977,
      "receipt": {
        "path": "/mnt/fast-scratch/dope-benchmark/dope-s3-artifact-compression-probe-v1/59ab5319e1b9031be213e87b92180bfcde08bf410648543464338f59fcae3f0e.level1.receipt.json",
        "sha256": "cc2f627bf7f2c701b9ccf25cfb96fb7640db502b22284cadb025bf1e6747b891"
      },
      "release_safe_l3": null
    },
    {
      "artifact_sha256": "bbf7d3bec3788781f5aa68603b30142b5ab70a2e91e9d8282f912120c7d713f0",
      "byte_cap_satisfied": true,
      "compression_level": 9,
      "container_bytes": 7973,
      "container_header_bytes": 80,
      "dataset": "654566a1f91408aa",
      "elapsed_seconds": 0.0012659269850701094,
      "encoding_replay_exact": true,